{
  "/Users/cinos81/works/doctor_guide_api/serverless.yml": {
    "versionFramework": "4.14.4",
    "servicePath": "/Users/cinos81/works/doctor_guide_api/serverless.yml",
    "serviceConfigFileName": "serverless.yml",
    "service": {
      "org": "illuwa",
      "service": "doctor-guide-api",
      "provider": {
        "name": "aws",
        "runtime": "nodejs22.x",
        "region": "ap-northeast-2",
        "stage": "dev",
        "profile": "jurloogar",
        "iamRoleStatements": [
          {
            "Effect": "Allow",
            "Action": [
              "dynamodb:Query",
              "dynamodb:Scan",
              "dynamodb:GetItem",
              "dynamodb:PutItem",
              "dynamodb:UpdateItem",
              "dynamodb:DeleteItem"
            ],
            "Resource": [
              {
                "Fn::GetAtt": ["HospitalSafetydata", "Arn"]
              },
              {
                "Fn::Sub": "${HospitalSafetydata.Arn}/index/*"
              },
              {
                "Fn::GetAtt": ["PharmacySafetydata", "Arn"]
              },
              {
                "Fn::Sub": "${PharmacySafetydata.Arn}/index/*"
              }
            ]
          }
        ],
        "versionFunctions": true
      },
      "package": {
        "patterns": [
          "!node_modules/**",
          "!*.ts",
          "!tsconfig.json",
          "!.git/**",
          "!.vscode/**",
          "dist/**/*.js"
        ],
        "artifactsS3KeyDirname": "serverless/doctor-guide-api/dev/code-artifacts"
      },
      "resources": {
        "Resources": {
          "HospitalSafetydata": {
            "Type": "AWS::DynamoDB::Table",
            "Properties": {
              "TableName": "Hospital",
              "BillingMode": "PAY_PER_REQUEST",
              "AttributeDefinitions": [
                {
                  "AttributeName": "pk",
                  "AttributeType": "S"
                },
                {
                  "AttributeName": "sk",
                  "AttributeType": "S"
                },
                {
                  "AttributeName": "HSPTL_CLSF_NM",
                  "AttributeType": "S"
                },
                {
                  "AttributeName": "INST_NM",
                  "AttributeType": "S"
                },
                {
                  "AttributeName": "EMRO_OPER_YN_",
                  "AttributeType": "S"
                },
                {
                  "AttributeName": "ADDR_REGION",
                  "AttributeType": "S"
                }
              ],
              "KeySchema": [
                {
                  "AttributeName": "pk",
                  "KeyType": "HASH"
                },
                {
                  "AttributeName": "sk",
                  "KeyType": "RANGE"
                }
              ],
              "GlobalSecondaryIndexes": [
                {
                  "IndexName": "hospital-classification-index",
                  "KeySchema": [
                    {
                      "AttributeName": "HSPTL_CLSF_NM",
                      "KeyType": "HASH"
                    },
                    {
                      "AttributeName": "INST_NM",
                      "KeyType": "RANGE"
                    }
                  ],
                  "Projection": {
                    "ProjectionType": "ALL"
                  }
                },
                {
                  "IndexName": "hospital-name-index",
                  "KeySchema": [
                    {
                      "AttributeName": "INST_NM",
                      "KeyType": "HASH"
                    }
                  ],
                  "Projection": {
                    "ProjectionType": "ALL"
                  }
                },
                {
                  "IndexName": "emergency-room-index",
                  "KeySchema": [
                    {
                      "AttributeName": "EMRO_OPER_YN_",
                      "KeyType": "HASH"
                    },
                    {
                      "AttributeName": "HSPTL_CLSF_NM",
                      "KeyType": "RANGE"
                    }
                  ],
                  "Projection": {
                    "ProjectionType": "ALL"
                  }
                },
                {
                  "IndexName": "region-index",
                  "KeySchema": [
                    {
                      "AttributeName": "ADDR_REGION",
                      "KeyType": "HASH"
                    },
                    {
                      "AttributeName": "INST_NM",
                      "KeyType": "RANGE"
                    }
                  ],
                  "Projection": {
                    "ProjectionType": "ALL"
                  }
                }
              ]
            }
          },
          "PharmacySafetydata": {
            "Type": "AWS::DynamoDB::Table",
            "Properties": {
              "TableName": "Pharmacy",
              "BillingMode": "PAY_PER_REQUEST",
              "AttributeDefinitions": [
                {
                  "AttributeName": "pk",
                  "AttributeType": "S"
                },
                {
                  "AttributeName": "sk",
                  "AttributeType": "S"
                },
                {
                  "AttributeName": "INST_NM",
                  "AttributeType": "S"
                },
                {
                  "AttributeName": "ADDR_REGION",
                  "AttributeType": "S"
                },
                {
                  "AttributeName": "WKND_MDEXM_YN",
                  "AttributeType": "S"
                }
              ],
              "KeySchema": [
                {
                  "AttributeName": "pk",
                  "KeyType": "HASH"
                },
                {
                  "AttributeName": "sk",
                  "KeyType": "RANGE"
                }
              ],
              "GlobalSecondaryIndexes": [
                {
                  "IndexName": "pharmacy-name-index",
                  "KeySchema": [
                    {
                      "AttributeName": "INST_NM",
                      "KeyType": "HASH"
                    }
                  ],
                  "Projection": {
                    "ProjectionType": "ALL"
                  }
                },
                {
                  "IndexName": "pharmacy-region-index",
                  "KeySchema": [
                    {
                      "AttributeName": "ADDR_REGION",
                      "KeyType": "HASH"
                    },
                    {
                      "AttributeName": "INST_NM",
                      "KeyType": "RANGE"
                    }
                  ],
                  "Projection": {
                    "ProjectionType": "ALL"
                  }
                },
                {
                  "IndexName": "pharmacy-weekend-index",
                  "KeySchema": [
                    {
                      "AttributeName": "WKND_MDEXM_YN",
                      "KeyType": "HASH"
                    },
                    {
                      "AttributeName": "INST_NM",
                      "KeyType": "RANGE"
                    }
                  ],
                  "Projection": {
                    "ProjectionType": "ALL"
                  }
                }
              ]
            }
          }
        }
      },
      "functions": {
        "hospital": {
          "handler": "dist/index.handler",
          "events": [
            {
              "httpApi": {
                "path": "/hospital",
                "method": "get"
              }
            }
          ],
          "name": "doctor-guide-api-dev-hospital"
        },
        "pharmacy": {
          "handler": "dist/index.handler",
          "events": [
            {
              "httpApi": {
                "path": "/pharmacy",
                "method": "get"
              }
            }
          ],
          "name": "doctor-guide-api-dev-pharmacy"
        }
      }
    },
    "provider": {
      "name": "aws",
      "runtime": "nodejs22.x",
      "region": "ap-northeast-2",
      "stage": "dev",
      "profile": "jurloogar",
      "iamRoleStatements": [
        {
          "Effect": "Allow",
          "Action": [
            "dynamodb:Query",
            "dynamodb:Scan",
            "dynamodb:GetItem",
            "dynamodb:PutItem",
            "dynamodb:UpdateItem",
            "dynamodb:DeleteItem"
          ],
          "Resource": [
            {
              "Fn::GetAtt": ["HospitalSafetydata", "Arn"]
            },
            {
              "Fn::Sub": "${HospitalSafetydata.Arn}/index/*"
            },
            {
              "Fn::GetAtt": ["PharmacySafetydata", "Arn"]
            },
            {
              "Fn::Sub": "${PharmacySafetydata.Arn}/index/*"
            }
          ]
        }
      ],
      "versionFunctions": true
    },
    "dashboard": {
      "isEnabledForService": false,
      "requiredAuthentication": false,
      "orgFeaturesInUse": null,
      "orgObservabilityIntegrations": null,
      "serviceAppId": null,
      "serviceProvider": null,
      "instanceParameters": null
    },
    "error": {
      "message": "Access denied when storing the parameter \"/serverless-framework/deployment/s3-bucket\". Please check your permissions and try again. You have the following options:\n• Ensure you have permission to create SSM and S3 resources.\n• Use the \"provider.deploymentBucket\" field to specify an existing S3 bucket.\n• Manually create the S3 bucket and SSM parameter.\n\nFor more details, please refer to the documentation: https://www.serverless.com/framework/docs/guides/deployment-bucket\n\nOriginal error: An error occurred while fetching the SSM parameter \"/serverless-framework/deployment/s3-bucket\": User: arn:aws:iam::166287530750:user/julooga-jaewon is not authorized to perform: ssm:GetParameter on resource: arn:aws:ssm:ap-northeast-2:166287530750:parameter/serverless-framework/deployment/s3-bucket because no identity-based policy allows the ssm:GetParameter action",
      "code": "DEPLOYMENT_BUCKET_INSUFFICIENT_PERMISSIONS"
    },
    "serviceRawFile": "# \"org\" ensures this Service is used with the correct Serverless Framework Access Key.\norg: illuwa\n# \"service\" is the name of this project. This will also be added to your AWS resource names.\nservice: doctor-guide-api\n\nprovider:\n  name: aws\n  runtime: nodejs22.x\n  region: ap-northeast-2\n  stage: ${opt:stage, 'dev'}\n  profile: jurloogar\n  iamRoleStatements:\n    - Effect: Allow\n      Action:\n        - dynamodb:Query\n        - dynamodb:Scan\n        - dynamodb:GetItem\n        - dynamodb:PutItem\n        - dynamodb:UpdateItem\n        - dynamodb:DeleteItem\n      Resource:\n        - !GetAtt HospitalSafetydata.Arn\n        - !Sub '${HospitalSafetydata.Arn}/index/*'\n        - !GetAtt PharmacySafetydata.Arn\n        - !Sub '${PharmacySafetydata.Arn}/index/*'\n\npackage:\n  patterns:\n    - '!node_modules/**'\n    - '!*.ts'\n    - '!tsconfig.json'\n    - '!.git/**'\n    - '!.vscode/**'\n    - 'dist/**/*.js'\n\nresources:\n  Resources:\n    HospitalSafetydata:\n      Type: AWS::DynamoDB::Table\n      Properties:\n        TableName: Hospital\n        BillingMode: PAY_PER_REQUEST\n        AttributeDefinitions:\n          - AttributeName: pk\n            AttributeType: S\n          - AttributeName: sk\n            AttributeType: S\n          - AttributeName: HSPTL_CLSF_NM\n            AttributeType: S\n          - AttributeName: INST_NM\n            AttributeType: S\n          - AttributeName: EMRO_OPER_YN_\n            AttributeType: S\n          - AttributeName: ADDR_REGION\n            AttributeType: S\n        KeySchema:\n          - AttributeName: pk\n            KeyType: HASH\n          - AttributeName: sk\n            KeyType: RANGE\n        GlobalSecondaryIndexes:\n          - IndexName: hospital-classification-index\n            KeySchema:\n              - AttributeName: HSPTL_CLSF_NM\n                KeyType: HASH\n              - AttributeName: INST_NM\n                KeyType: RANGE\n            Projection:\n              ProjectionType: ALL\n          - IndexName: hospital-name-index\n            KeySchema:\n              - AttributeName: INST_NM\n                KeyType: HASH\n            Projection:\n              ProjectionType: ALL\n          - IndexName: emergency-room-index\n            KeySchema:\n              - AttributeName: EMRO_OPER_YN_\n                KeyType: HASH\n              - AttributeName: HSPTL_CLSF_NM\n                KeyType: RANGE\n            Projection:\n              ProjectionType: ALL\n          - IndexName: region-index\n            KeySchema:\n              - AttributeName: ADDR_REGION\n                KeyType: HASH\n              - AttributeName: INST_NM\n                KeyType: RANGE\n            Projection:\n              ProjectionType: ALL\n    PharmacySafetydata:\n      Type: AWS::DynamoDB::Table\n      Properties:\n        TableName: Pharmacy\n        BillingMode: PAY_PER_REQUEST\n        AttributeDefinitions:\n          - AttributeName: pk\n            AttributeType: S\n          - AttributeName: sk\n            AttributeType: S\n          - AttributeName: INST_NM\n            AttributeType: S\n          - AttributeName: ADDR_REGION\n            AttributeType: S\n          - AttributeName: WKND_MDEXM_YN\n            AttributeType: S\n        KeySchema:\n          - AttributeName: pk\n            KeyType: HASH\n          - AttributeName: sk\n            KeyType: RANGE\n        GlobalSecondaryIndexes:\n          - IndexName: pharmacy-name-index\n            KeySchema:\n              - AttributeName: INST_NM\n                KeyType: HASH\n            Projection:\n              ProjectionType: ALL\n          - IndexName: pharmacy-region-index\n            KeySchema:\n              - AttributeName: ADDR_REGION\n                KeyType: HASH\n              - AttributeName: INST_NM\n                KeyType: RANGE\n            Projection:\n              ProjectionType: ALL\n          - IndexName: pharmacy-weekend-index\n            KeySchema:\n              - AttributeName: WKND_MDEXM_YN\n                KeyType: HASH\n              - AttributeName: INST_NM\n                KeyType: RANGE\n            Projection:\n              ProjectionType: ALL\n\nfunctions:\n  hospital:\n    handler: dist/index.handler\n    events:\n      - httpApi:\n          path: /hospital\n          method: get\n  pharmacy:\n    handler: dist/index.handler\n    events:\n      - httpApi:\n          path: /pharmacy\n          method: get\n",
    "command": ["deploy"],
    "options": {},
    "orgId": "1c117ed4-6752-4e16-bf13-c9a9b5d7f680",
    "orgName": "illuwa",
    "userId": "6KxJWZFY5TGtPg04S0",
    "userName": "illuwa",
    "serviceProviderAwsAccountId": "166287530750",
    "serviceProviderAwsCfStackId": null,
    "serviceProviderAwsCfStackCreated": null,
    "serviceProviderAwsCfStackUpdated": null,
    "serviceProviderAwsCfStackStatus": null,
    "serviceProviderAwsCfStackOutputs": null
  }
}
